{
    "$schema": "../schema.json",
    "id": "default",
    "name": "Medium",
    "description": "1.5× raptor and queen HP",
    "configuration": {
        "gameMap": "Full Metal Plate (12P)",
        "lobbyName": "Raptors [Medium][Mini Bosses][1_5x QHP 1_5x HP]",
        "raptorHpMult": 1.5,
        "queenHpMult": 1.5,
        "challenges": "Mini Bosses",
        "start": "No rush",
        "incomeMult": 1.3,
        "buildPowerMult": 1.3,
        "buildDistMult": 1.5,
        "queenCount": 42
    }
}
