{
    "$schema": "../schema.json",
    "id": "casual",
    "name": "Casual",
    "description": "1.3× HP, 2× income",
    "status": "enabled",
    "configuration": {
        "gameMap": "Full Metal Plate (12P)",
        "lobbyName": "Raptors [Casual][1_3x QHP 1_3x HP]",
        "raptorHpMult": 1.3,
        "queenHpMult": 1.3,
        "challenges": "None",
        "start": "No rush",
        "incomeMult": 2,
        "buildPowerMult": 2,
        "buildDistMult": 2,
        "queenCount": 6
    }
}
